[
  {
    "task_id": "python-orientation",
    "repository_path": ".",
    "task_family": "orientation",
    "timeout_seconds": 180
  },
  {
    "task_id": "python-change-analysis",
    "repository_path": ".",
    "task_family": "change_analysis",
    "target_selector": {
      "repository_rel_path": "src/suitcode/mcp/service.py"
    },
    "timeout_seconds": 180
  },
  {
    "task_id": "python-minimum-verified",
    "repository_path": ".",
    "task_family": "minimum_verified_change_set",
    "target_selector": {
      "repository_rel_path": "src/suitcode/mcp/service.py"
    },
    "timeout_seconds": 180
  },
  {
    "task_id": "python-truth-coverage",
    "repository_path": ".",
    "task_family": "truth_coverage",
    "timeout_seconds": 180
  },
  {
    "task_id": "python-test-execution",
    "repository_path": ".",
    "task_family": "test_execution",
    "timeout_seconds": 300
  },
  {
    "task_id": "npm-orientation",
    "repository_path": "tests/test_repos/npm",
    "task_family": "orientation",
    "timeout_seconds": 180
  },
  {
    "task_id": "npm-minimum-verified",
    "repository_path": "tests/test_repos/npm",
    "task_family": "minimum_verified_change_set",
    "target_selector": {
      "repository_rel_path": "packages/core/src/index.ts"
    },
    "timeout_seconds": 180
  },
  {
    "task_id": "npm-build-execution",
    "repository_path": "tests/test_repos/npm",
    "task_family": "build_execution",
    "timeout_seconds": 300
  }
]
